### ISSUE TITLE
FilaMan sends redundant Authorization: Bearer header alongside X-Api-Key, causing Moonraker JWT decode failure and false 401

### ISSUE THREAD

**Issue by DerUnwissende** [Fire-Devils/filaman-system#106]
only Info: Claud helped to create this issue

## Summary
FilaMan sends both X-Api-Key and Authorization: Bearer headers 
simultaneously (identical value) on every poll to Moonraker's 
/server/filaman/status. Moonraker routes the Authorization header into 
JWT validation, causing an unhandled ValueError and false 401 — despite 
the same key being valid via X-Api-Key alone.

## Environment
- Moonraker commit: d5ee17128bb88434aacdab90c2e9e990e2b64e4a (2026-06-29)
- FilaMan image: ghcr.io/fire-devils/filaman-system:latest 
  (no fixed version tag)
- FilaMan runtime: Python 3.11.15, aiohttp 3.14.1

## Evidence
Packet capture (tcpdump, port 7125) of FilaMan's actual request:
GET /server/filaman/status HTTP/1.1
Host: 192.168.0.152:7125
Content-Type: application/json
X-Api-Key: <redacted>
Authorization: Bearer <redacted>
Accept: */*
Accept-Encoding: gzip, deflate
User-Agent: Python/3.11 aiohttp/3.14.1

Manual reproduction confirming key validity via X-Api-Key alone:
$ docker exec filaman-system-app python3 -c "import urllib.request; req = urllib.request.Request('http://192.168.0.152:7125/server/filaman/status', headers={'X-Api-Key': '<redacted>'}); r = urllib.request.urlopen(req); print(r.status)"
200

Moonraker traceback during actual FilaMan polling (both headers present):
authorization.py:780 _check_json_web_token()
  return self.decode_jwt(auth_token, check_exp=required)
authorization.py:656 decode_jwt()
  message, sig = token.rsplit('.', maxsplit=1)
ValueError: not enough values to unpack (expected 2, got 1)
401 GET /server/filaman/status ... JWT Decode Error

## Root Cause
FilaMan's HTTP client redundantly sends the Moonraker API key as both 
X-Api-Key and Authorization: Bearer. Moonraker processes the 
Authorization header and routes it into JWT validation regardless of 
token format, causing an unhandled exception and false 401.

## Requested Fix
1. FilaMan (primary): remove Authorization: Bearer, send X-Api-Key only.
2. Moonraker (secondary, defensive): prioritize X-Api-Key when present, 
   or catch decode exceptions for non-JWT tokens.

## Separate, unrelated issue
Moonraker → FilaMan requests (FilaMan API key from [filaman] config 
block) independently return 401 "Authentication required" on FilaMan's 
side. Different key, different direction, tracked separately.

**Additional Information:**

Moonraker Version:
`/moonraker $ docker inspect filaman-system-app | grep -i "image\|version"
        "Image": "sha256:5f936972cb845cfda2cc8302523017cc39c6707456ab9826a17e0e11fce44afe",
                "PYTHON_VERSION=3.11.15",
            "Image": "ghcr.io/fire-devils/filaman-system:latest",
                "com.docker.compose.image": "sha256:5f936972cb845cfda2cc8302523017cc39c6707456ab9826a17e0e11fce44afe",
                "com.docker.compose.version": "5.3.0"
        "ImageManifestDescriptor": {
            "mediaType": "application/vnd.oci.image.manifest.v1+json",`

**Excerpt from the recording**

`adm1npi4@RaspPI4:~/filaman $ sudo tcpdump -A -r /tmp/filaman_capture.pcap | grep -A15 "GET /server/filaman/status" | head -30
reading from file /tmp/filaman_capture.pcap, link-type LINUX_SLL2 (Linux cooked v2), snapshot length 262144
Warning: interface names might be incorrect
.^..a...GET /server/filaman/status HTTP/1.1
Host: 192.168.0.152:7125
Content-Type: application/json
X-Api-Key: 38b5977960594ea98eaab671124f
Authorization: Bearer 38b5977960594ea98eaab671124f
Accept: */*
Accept-Encoding: gzip, deflate
User-Agent: Python/3.11 aiohttp/3.14.1
13:18:00.105193 br-5de159bb35e3 In  IP 172.18.0.2.50564 > RaspPI4.fritz.box.7125: Flags [P.], seq 1:284, ack 1, win 502, options [nop,nop,TS val 2455641761 ecr 1641885378], length 283
E..O..@.@...............W=&5h.......n......
.^..a...GET /server/filaman/status HTTP/1.1
Host: 192.168.0.152:7125
Content-Type: application/json
X-Api-Key: 38b5977960594ea98eaab671124f
Authorization: Bearer 38b5977960594ea98eaab671124f
Accept: */*
Accept-Encoding: gzip, deflate
User-Agent: Python/3.11 aiohttp/3.14.1
13:18:00.105236 br-5de159bb35e3 Out IP RaspPI4.fritz.box.7125 > 172.18.0.2.50564: Flags [.], ack 284, win 507, options [nop,nop,TS val 1641885380 ecr 2455641761], length 0
E..4..@.@.!.............h...W='P....m{.....
a....^..
13:18:00.105247 vethe7a636d Out IP RaspPI4.fritz.box.7125 > 172.18.0.2.50564: Flags [.], ack 284, win 507, options [nop,nop,TS val 1641885380 ecr 2455641761], length 0
E..4..@.@.!.............h...W='P....m{.....
a....^..`

**Comment by DerUnwissende** [comment]
@ManuelW77 
do you have an idea or solution, maybe workaround? 
I can't bring it running
I would be very pleased about a feedback from you.

**Comment by DerUnwissende** [comment]
@ManuelW77 
I apologize for being annoying, but do you require any additional information or clarification to provide a concise feedback? If you have any questions regarding this issue, please don't hesitate to ask. I will do my utmost to assist you.

**Comment by ManuelW77** [comment]
Thanks for reporting. The failure wasn't at the filaman system itself, it was at the filaman moonraker plugin.
Please update the plugin to resolve this.

**Comment by DerUnwissende** [comment]
@ManuelW77 
only to be sure that i do the right things....
<img width="1188" height="719" alt="Image" src="https://github.com/user-attachments/assets/d2eab0c3-fa2d-47e7-9427-48870e764303" />
The API-Key i have to store in moonraker.conf is the API-Key i generated in this area (see screenshot)... right?
i am still struggling to connect filaman and moonraker...
I would be very pleased about a feedback from you.

**Comment by DerUnwissende** [comment]
BTW... if you click "Copy" there, the key isn't copied to the clipboard. I tried it with Safari and Chrome—it doesn't work in either?
